[
  {
    "id": "sum-gan",
    "title": "Unsupervised Video Summarization with Adversarial LSTM Networks",
    "venue": "CVPR",
    "paper_url": "https://openaccess.thecvf.com/content_cvpr_2017/html/Mahasseni_Unsupervised_Video_Summarization_CVPR_2017_paper.html",
    "project_url": "Not reported",
    "encoders": "ImageNet GoogLeNet pool5 (1024-D); feature configuration in reconstruction chapter",
    "sampling": "Not independently verified; encoder is GoogLeNet pool5",
    "architecture": "2-layer BiLSTM selector; VAE-LSTM encoder/reverse decoder and LSTM discriminator",
    "fusion": "Visual-only; no audio/text fusion in described configuration",
    "objective": "Exact primary-source equations and paper/code discrepancies are transcribed in docs/04-reconstruction-generative.md, 3. SUM-GAN",
    "training_data": "SumMe and TVSum training subsets; source-specific additional datasets only where explicitly described in the chapter",
    "test_data": "SumMe; TVSum",
    "split": "Five random splits; synthesized reference results; augmented pool in separate experiment",
    "budget": "15% final duration; soft training length target is separate",
    "postprocessing": "KTS, pooled shot ranking under 15%; exact knapsack not established by paper",
    "code_url": "https://github.com/j-min/Adversarial_Video_Summary",
    "code_status": "Community; changes backbone and training",
    "framework": "Not independently verified",
    "weights": "Not independently verified",
    "features": "See source-specific artifact status in chapter and resource catalog",
    "reproducibility": "Inherited 2026-09-06 narrative audit migrated to structured catalog; no new model execution or full numerical re-audit",
    "limitations": "Technical record retained from 2026-09-06 source audit; see chapter for method-specific protocol and implementation limitations. No independent training or numerical reproduction.",
    "verified_on": "2026-09-06",
    "authors": [
      "Behrooz Mahasseni",
      "Michael Lam",
      "Sinisa Todorovic"
    ],
    "supervision": [
      "unsupervised"
    ],
    "tasks": [
      "generic single-video"
    ],
    "outputs": [
      "keyshot/video skim"
    ],
    "mechanisms": [
      "reconstruction",
      "adversarial learning"
    ],
    "metrics": [
      "temporal F1"
    ],
    "sources": [
      "https://openaccess.thecvf.com/content_cvpr_2017/html/Mahasseni_Unsupervised_Video_Summarization_CVPR_2017_paper.html",
      "https://github.com/j-min/Adversarial_Video_Summary"
    ],
    "year": 2017
  },
  {
    "id": "cycle-sum",
    "title": "Cycle-SUM: Cycle-Consistent Adversarial LSTM Networks for Unsupervised Video Summarization",
    "venue": "AAAI",
    "paper_url": "https://arxiv.org/abs/1904.08265",
    "project_url": "Not reported",
    "encoders": "ImageNet GoogLeNet pool5 (1024-D); feature configuration in reconstruction chapter",
    "sampling": "Not independently verified; encoder is GoogLeNet pool5",
    "architecture": "3-layer 300-unit BiLSTM selector; two VAE-LSTM generators and two Wasserstein critics",
    "fusion": "Visual-only; no audio/text fusion in described configuration",
    "objective": "Exact primary-source equations and paper/code discrepancies are transcribed in docs/04-reconstruction-generative.md, 4. Cycle-SUM",
    "training_data": "SumMe and TVSum training subsets; source-specific additional datasets only where explicitly described in the chapter",
    "test_data": "SumMe; TVSum",
    "split": "Five random runs; synthesized-reference protocol",
    "budget": "15% final duration; soft training length target is separate",
    "postprocessing": "KTS and source-specific budgeted shot selection",
    "code_url": "Not independently verified",
    "code_status": "No official release found in inherited audit",
    "framework": "Not independently verified",
    "weights": "Not independently verified",
    "features": "See source-specific artifact status in chapter and resource catalog",
    "reproducibility": "Inherited 2026-09-06 narrative audit migrated to structured catalog; no new model execution or full numerical re-audit",
    "limitations": "Technical record retained from 2026-09-06 source audit; see chapter for method-specific protocol and implementation limitations. No independent training or numerical reproduction.",
    "verified_on": "2026-09-06",
    "authors": [
      "Li Yuan",
      "Francis E. H. Tay",
      "Ping Li",
      "Li Zhou",
      "Jiashi Feng"
    ],
    "supervision": [
      "unsupervised"
    ],
    "tasks": [
      "generic single-video"
    ],
    "outputs": [
      "keyshot/video skim"
    ],
    "mechanisms": [
      "reconstruction",
      "adversarial learning"
    ],
    "metrics": [
      "temporal F1"
    ],
    "sources": [
      "https://arxiv.org/abs/1904.08265"
    ],
    "year": 2019
  },
  {
    "id": "acgan",
    "title": "Unsupervised Video Summarization with Attentive Conditional Generative Adversarial Networks",
    "venue": "ACM Multimedia",
    "paper_url": "https://doi.org/10.1145/3343031.3351056",
    "project_url": "Not reported",
    "encoders": "ImageNet GoogLeNet pool5 (1024-D); feature configuration in reconstruction chapter",
    "sampling": "Not reported",
    "architecture": "Self-attention, BiLSTM and score layers; conditional discriminator receives hard top-k features",
    "fusion": "Visual-only; no audio/text fusion in described configuration",
    "objective": "Conditional adversarial objective; nonsaturating generator loss. No separate reconstruction, diversity or soft sparsity loss; see chapter Section 5.",
    "training_data": "SumMe and TVSum training subsets; source-specific additional datasets only where explicitly described in the chapter",
    "test_data": "SumMe; TVSum",
    "split": "Five-fold CV; augmented and transfer experiments separately described",
    "budget": "15% final duration; soft training length target is separate",
    "postprocessing": "KTS and budgeted selection; exact implementation not independently verified",
    "code_url": "Not independently verified",
    "code_status": "No official source found in inherited audit",
    "framework": "TensorFlow stated in primary paper",
    "weights": "Not independently verified",
    "features": "See source-specific artifact status in chapter and resource catalog",
    "reproducibility": "Inherited 2026-09-06 narrative audit migrated to structured catalog; no new model execution or full numerical re-audit",
    "limitations": "Technical record retained from 2026-09-06 source audit; see chapter for method-specific protocol and implementation limitations. No independent training or numerical reproduction.",
    "verified_on": "2026-09-06",
    "authors": [
      "Xufeng He",
      "Yang Hua",
      "Tao Song",
      "Zongpu Zhang",
      "Zhengui Xue",
      "Ruhui Ma",
      "Neil Robertson",
      "Haibing Guan"
    ],
    "supervision": [
      "unsupervised"
    ],
    "tasks": [
      "generic single-video"
    ],
    "outputs": [
      "keyshot/video skim"
    ],
    "mechanisms": [
      "conditional adversarial learning",
      "self-attention",
      "hard top-k conditioning"
    ],
    "metrics": [
      "temporal F1"
    ],
    "sources": [
      "https://doi.org/10.1145/3343031.3351056"
    ],
    "year": 2019
  },
  {
    "id": "sum-gan-sl",
    "title": "A Stepwise, Label-based Approach for Improving the Adversarial Training in Unsupervised Video Summarization",
    "venue": "AI4TV at ACM Multimedia",
    "paper_url": "https://doi.org/10.1145/3347449.3357482",
    "project_url": "Not reported",
    "encoders": "ImageNet GoogLeNet pool5 (1024-D); feature configuration in reconstruction chapter",
    "sampling": "2-fps standard features; exact source-specific configuration in reconstruction chapter",
    "architecture": "1024-to-500 compression, BiLSTM selector, VAE-LSTMs, stepwise least-squares discriminator updates",
    "fusion": "Visual-only; no audio/text fusion in described configuration",
    "objective": "Exact primary-source equations and paper/code discrepancies are transcribed in docs/04-reconstruction-generative.md, 6.1 SUM-GAN-sl",
    "training_data": "SumMe and TVSum training subsets; source-specific additional datasets only where explicitly described in the chapter",
    "test_data": "SumMe; TVSum",
    "split": "Paper says 5-fold CV; released overlapping random 80/20 JSON splits conflict",
    "budget": "15% final duration; soft training length target is separate",
    "postprocessing": "KTS, mean shot scores, exact knapsack",
    "code_url": "https://github.com/e-apostolidis/SUM-GAN-sl",
    "code_status": "Official",
    "framework": "Python 3.6 / PyTorch 1.0.1 (author release)",
    "weights": "Not independently verified",
    "features": "See source-specific artifact status in chapter and resource catalog",
    "reproducibility": "Inherited 2026-09-06 narrative audit migrated to structured catalog; no new model execution or full numerical re-audit",
    "limitations": "Technical record retained from 2026-09-06 source audit; see chapter for method-specific protocol and implementation limitations. No independent training or numerical reproduction.",
    "verified_on": "2026-09-06",
    "authors": [
      "Evlampios Apostolidis",
      "Alexandros I. Metsai",
      "Eleni Adamantidou",
      "Vasileios Mezaris",
      "Ioannis Patras"
    ],
    "supervision": [
      "unsupervised"
    ],
    "tasks": [
      "generic single-video"
    ],
    "outputs": [
      "keyshot/video skim"
    ],
    "mechanisms": [
      "reconstruction",
      "adversarial learning"
    ],
    "metrics": [
      "temporal F1"
    ],
    "sources": [
      "https://doi.org/10.1145/3347449.3357482",
      "https://github.com/e-apostolidis/SUM-GAN-sl"
    ],
    "year": 2019
  },
  {
    "id": "sum-gan-aae",
    "title": "Unsupervised Video Summarization via Attention-Driven Adversarial Learning",
    "venue": "MMM",